"States person under any applicable Treasury regulations), or any estate or trust the income of which is subject to U.S. federal income taxation regardless of its"
"source."
"Redemption for Tax Reasons"
"If, as a result of any change in, or amendment to, or, in the case of the 0.000% 2025 Notes and the 2031 Notes, introduction of, the laws (or any"
"regulations or rulings promulgated under the laws) of the United States (or any political subdivision or taxing authority of or in the United States), or any change"
"in, or amendments to, an official position regarding the application or interpretation of such laws, regulations or rulings, which change or amendment is"
"announced or becomes effective on or after the date of the applicable prospectus supplement, we become, or based upon a written opinion of independent"
"counsel selected by us, will become obligated to pay additional amounts as described above under the heading “Payments of Additional Amounts” with respect"
"to a series of the Notes, then we may at our option redeem, in whole, but not in part, in the case of the 2024 Notes, the 2026 Notes, the 2027 Notes, the 3.050%"
"2029 Notes and the 2042 Notes, the Notes of such series on not less than 30 nor more than 60 days’ prior notice, in the case of the 0.875% 2025 Notes and the"
"1.375% 2029 Notes, the Notes of such series on not less than 15 nor more than 60 days’ notice, and in the case of the 0.000% 2025 Notes and the 2031 Notes,"
"the Notes of such series on not less than 10 nor more than 60 days’ prior notice, in each case at a redemption price equal to 100% of their principal amount,"
"together with interest accrued but unpaid on those Notes to (and, in the case of the 0.000% 2025 Notes and the 2031 Notes, but not including) the date fixed for"
"redemption."
"Optional Redemption"
"We may redeem the 2024 Notes, the 2026 Notes, the 2027 Notes, the 3.050% 2029 Notes and the 2042 Notes at our option, at any time in whole or"
"from time to time in part, at a redemption price equal to the greater of:"
